movieId,title,year,genres_clean,content,avg_rating,rating_count
37729,Corpse Bride,2005,Animation Comedy Fantasy Musical Romance,corpse bride animation comedy fantasy musical romance,3.534090909090909,44.0
37731,Green Street Hooligans (a.k.a. Hooligans),2005,Crime Drama,green street hooligans crime drama,3.7222222222222223,9.0
37733,"History of Violence, A",2005,Action Crime Drama Thriller,history action crime drama thriller,3.5,27.0
37739,"Greatest Game Ever Played, The",2005,Drama,greatest game ever drama,3.3,5.0
37741,Capote,2005,Crime Drama,capote crime drama,3.869565217391304,23.0
37830,Final Fantasy VII: Advent Children,2004,Action Adventure Animation Fantasy Sci-Fi,final fantasy advent children action adventure animation fantasy,3.55,10.0
37857,MirrorMask,2005,Adventure Children Drama Fantasy,mirrormask adventure children drama fantasy,3.611111111111111,9.0
38038,Wallace & Gromit in The Curse of the Were-Rabbit,2005,Adventure Animation Children Comedy,wallace gromit curse adventure animation children comedy,3.6333333333333333,30.0
38061,Kiss Kiss Bang Bang,2005,Comedy Crime Mystery Thriller,kiss kiss bang bang comedy crime mystery thriller,4.071428571428571,35.0
38886,"Squid and the Whale, The",2005,Comedy Drama,squid comedy drama,3.4444444444444446,9.0
39183,Brokeback Mountain,2005,Drama Romance,brokeback mountain drama romance,3.5588235294117645,34.0
39292,"Good Night, and Good Luck.",2005,Crime Drama,good good crime drama,3.775,20.0
39381,"Proposition, The",2005,Crime Drama Western,crime drama western,3.5625,8.0
39400,"Fog, The",2005,Action Horror Mystery Thriller,action horror mystery thriller,2.1,5.0
39414,Shopgirl,2005,Comedy Drama Romance,shopgirl comedy drama romance,3.0,7.0
39435,"Legend of Zorro, The",2005,Action Adventure Drama Western,legend action adventure drama western,2.9,5.0
39444,"Weather Man, The",2005,Comedy Drama,weather comedy drama,3.388888888888889,9.0
39446,Saw II,2005,Horror Thriller,saw ii horror thriller,2.8076923076923075,13.0
39449,Prime,2005,Comedy Drama Romance,prime comedy drama romance,2.6,5.0
39715,American Pie Presents: Band Camp (American Pie 4: Band Camp),2005,Comedy,american pie band camp pie band comedy,2.142857142857143,7.0
40148,Revolver,2005,Crime Drama Thriller,revolver crime drama thriller,3.357142857142857,7.0
40278,Jarhead,2005,Action Drama War,jarhead action drama war,3.676470588235294,17.0
40339,Chicken Little,2005,Action Adventure Animation Children Comedy Sci-Fi,chicken little action adventure animation children comedy,2.2857142857142856,7.0
40414,Joyeux Noël (Merry Christmas),2005,Drama War,joyeux noël drama war,3.7,5.0
40581,Just Friends,2005,Comedy Romance,friends comedy romance,2.9166666666666665,6.0
40583,Syriana,2005,Drama Thriller,syriana drama thriller,3.53125,16.0
40629,Pride & Prejudice,2005,Drama Romance,pride prejudice drama romance,3.5555555555555554,27.0
40732,"Descent, The",2005,Adventure Drama Horror Thriller,adventure drama horror thriller,3.5454545454545454,11.0
40815,Harry Potter and the Goblet of Fire,2005,Adventure Fantasy Thriller IMAX,harry potter goblet fire adventure fantasy thriller imax,3.816901408450704,71.0
40819,Walk the Line,2005,Drama Musical Romance,walk line drama musical romance,3.7564102564102564,39.0
40826,Rent,2005,Drama Musical Romance,rent drama musical romance,3.15,10.0
41285,Match Point,2005,Crime Drama Romance,match point crime drama romance,3.4411764705882355,17.0
41566,"Chronicles of Narnia: The Lion, the Witch and the Wardrobe, The",2005,Adventure Children Fantasy,chronicles witch adventure children fantasy,3.443548387096774,62.0
41569,King Kong,2005,Action Adventure Drama Fantasy Thriller,king kong action adventure drama fantasy thriller,3.4,40.0
41571,Memoirs of a Geisha,2005,Drama Romance,memoirs geisha drama romance,3.5833333333333335,12.0
41573,"Family Stone, The",2005,Comedy Drama Romance,family comedy drama romance,2.875,8.0
41716,"Matador, The",2005,Comedy Drama Thriller,comedy drama thriller,3.2142857142857144,7.0
41863,"Three Burials of Melquiades Estrada, The",2006,Adventure Crime Drama,three burials melquiades adventure crime drama,4.0,5.0
41997,Munich,2005,Action Crime Drama Thriller,munich action crime drama thriller,3.8095238095238093,21.0
42002,"Producers, The",2005,Comedy Musical,comedy musical,3.388888888888889,9.0
42004,Transamerica,2005,Adventure Comedy Drama,transamerica adventure comedy drama,3.5,6.0
42011,Fun with Dick and Jane,2005,Comedy Crime,fun dick jane comedy crime,2.1818181818181817,11.0
42418,"New World, The",2005,Adventure Drama Romance,new adventure drama romance,3.2,5.0
42632,Lady Vengeance (Sympathy for Lady Vengeance) (Chinjeolhan geumjassi),2005,Crime Drama Mystery Thriller,lady vengeance lady crime drama mystery thriller,4.0,5.0
42718,District 13 (Banlieue 13),2004,Action Crime Sci-Fi,district action crime,3.8,5.0
42723,Hostel,2005,Horror,hostel horror,2.8636363636363638,11.0
42725,Grandma's Boy,2006,Comedy,boy comedy,2.5714285714285716,7.0
42728,Tristan & Isolde,2006,Drama Romance,tristan isolde drama romance,3.6,5.0
42738,Underworld: Evolution,2006,Action Fantasy Horror,evolution action fantasy horror,3.09375,16.0
43396,"World's Fastest Indian, The",2005,Drama,fastest drama,3.7857142857142856,7.0
43560,Nanny McPhee,2005,Children Comedy Fantasy,nanny mcphee children comedy fantasy,3.1666666666666665,6.0
43679,Final Destination 3,2006,Horror Mystery Thriller,final destination horror mystery thriller,2.8333333333333335,9.0
43836,"Pink Panther, The",2006,Adventure Comedy Crime,pink adventure comedy crime,2.857142857142857,7.0
43871,Firewall,2006,Crime Drama Thriller,firewall crime drama thriller,2.75,8.0
43904,When a Stranger Calls,2006,Horror Thriller,stranger calls horror thriller,1.3,5.0
43921,Running Scared,2006,Action Crime Thriller,running scared action crime thriller,3.3,5.0
43928,Ultraviolet,2006,Action Fantasy Sci-Fi Thriller,ultraviolet action fantasy thriller,1.9230769230769231,13.0
43936,16 Blocks,2006,Crime Thriller,blocks crime thriller,3.0,9.0
44004,Failure to Launch,2006,Comedy Romance,failure launch comedy romance,3.25,6.0
44022,Ice Age 2: The Meltdown,2006,Adventure Animation Children Comedy,ice age meltdown adventure animation children comedy,3.217391304347826,23.0
44191,V for Vendetta,2006,Action Sci-Fi Thriller IMAX,v vendetta action thriller imax,3.885,100.0
44193,She's the Man,2006,Comedy Romance,man comedy romance,3.75,6.0
44195,Thank You for Smoking,2006,Comedy Drama,thank smoking comedy drama,4.027777777777778,36.0
44199,Inside Man,2006,Crime Drama Thriller,inside man crime drama thriller,3.8,40.0
44397,"Hills Have Eyes, The",2006,Drama Horror Thriller,hills drama horror thriller,3.0833333333333335,6.0
44555,"Lives of Others, The (Das leben der Anderen)",2006,Drama Romance Thriller,lives leben der drama romance thriller,4.117647058823529,34.0
44665,Lucky Number Slevin,2006,Crime Drama Mystery,lucky number slevin crime drama mystery,3.8552631578947367,38.0
44694,Volver,2006,Comedy Drama,volver comedy drama,3.8125,8.0
44709,Akeelah and the Bee,2006,Drama,akeelah bee drama,3.8,5.0
44761,Brick,2005,Crime Drama Film-Noir Mystery,brick crime drama mystery,3.875,12.0
44788,This Film Is Not Yet Rated,2006,Documentary,film yet rated documentary,3.5,6.0
44828,Slither,2006,Comedy Horror Sci-Fi,slither comedy horror,3.0,5.0
44840,"Benchwarmers, The",2006,Comedy,comedy,2.772727272727273,11.0
44972,Scary Movie 4,2006,Comedy Horror,scary movie comedy horror,2.25,12.0
44974,Hard Candy,2005,Drama Thriller,hard candy drama thriller,3.5,12.0
45028,"Prairie Home Companion, A",2006,Comedy Drama Musical,prairie home comedy drama musical,3.6666666666666665,6.0
45081,Silent Hill,2006,Fantasy Horror Thriller,silent hill fantasy horror thriller,2.9583333333333335,12.0
45186,Mission: Impossible III,2006,Action Adventure Thriller,impossible iii action adventure thriller,3.5892857142857144,28.0
45210,United 93,2006,Crime Drama,united crime drama,4.142857142857143,7.0
45221,Stick It,2006,Comedy,stick comedy,2.5833333333333335,6.0
45431,Over the Hedge,2006,Adventure Animation Children Comedy,hedge adventure animation children comedy,3.4285714285714284,14.0
45440,Art School Confidential,2006,Comedy Drama,art school confidential comedy drama,3.3333333333333335,6.0
45447,"Da Vinci Code, The",2006,Drama Mystery Thriller,da vinci drama mystery thriller,3.122448979591837,49.0
45499,X-Men: The Last Stand,2006,Action Sci-Fi Thriller,last stand action thriller,3.355769230769231,52.0
45501,"Break-Up, The",2006,Comedy Drama Romance,comedy drama romance,2.590909090909091,11.0
45517,Cars,2006,Animation Children Comedy,cars animation children comedy,3.3780487804878048,41.0
45662,"Omen, The",2006,Horror Thriller,horror thriller,2.3,5.0
45666,Nacho Libre,2006,Comedy,nacho libre comedy,2.4642857142857144,14.0
45668,"Lake House, The",2006,Drama Fantasy Romance,lake drama fantasy romance,3.1,10.0
45672,Click,2006,Adventure Comedy Drama Fantasy Romance,click adventure comedy drama fantasy romance,2.9782608695652173,23.0
45720,"Devil Wears Prada, The",2006,Comedy Drama,devil wears comedy drama,3.5588235294117645,34.0
45722,Pirates of the Caribbean: Dead Man's Chest,2006,Action Adventure Fantasy,pirates dead chest action adventure fantasy,3.5069444444444446,72.0
45726,"You, Me and Dupree",2006,Comedy,dupree comedy,2.1666666666666665,6.0
45728,Clerks II,2006,Comedy,clerks ii comedy,3.8846153846153846,13.0
45730,Lady in the Water,2006,Drama Fantasy Mystery,lady water drama fantasy mystery,2.8333333333333335,9.0
45732,My Super Ex-Girlfriend,2006,Comedy Fantasy Romance,super comedy fantasy romance,1.5833333333333333,6.0
45880,Marie Antoinette,2006,Drama Romance,marie antoinette drama romance,3.1923076923076925,13.0
45928,Who Killed the Electric Car?,2006,Documentary,killed electric documentary,3.7,5.0
45950,"Inconvenient Truth, An",2006,Documentary,inconvenient documentary,3.576923076923077,13.0
46322,Jet Li's Fearless (Huo Yuan Jia),2006,Action Drama,jet fearless yuan action drama,3.125,8.0
46335,"Fast and the Furious: Tokyo Drift, The (Fast and the Furious 3, The)",2006,Action Crime Drama Thriller,fast tokyo furious action crime drama thriller,2.090909090909091,11.0
46530,Superman Returns,2006,Action Adventure Sci-Fi IMAX,superman returns action adventure imax,3.08,25.0
46578,Little Miss Sunshine,2006,Adventure Comedy Drama,little miss sunshine adventure comedy drama,3.883116883116883,77.0
46723,Babel,2006,Drama Thriller,babel drama thriller,3.5,31.0
46948,Monster House,2006,Animation Children Fantasy Mystery,monster house animation children fantasy mystery,3.111111111111111,9.0
46965,Snakes on a Plane,2006,Action Comedy Horror Thriller,snakes plane action comedy horror thriller,2.642857142857143,14.0
46970,Talladega Nights: The Ballad of Ricky Bobby,2006,Action Comedy,talladega ballad ricky bobby action comedy,3.25,28.0
46972,Night at the Museum,2006,Action Comedy Fantasy IMAX,night museum action comedy fantasy imax,3.239130434782609,23.0
46974,World Trade Center,2006,Drama,world trade center drama,2.6666666666666665,6.0
46976,Stranger than Fiction,2006,Comedy Drama Fantasy Romance,stranger fiction comedy drama fantasy romance,3.6931818181818183,44.0
47044,Miami Vice,2006,Action Crime Drama Thriller,miami vice action crime drama thriller,2.75,10.0
47099,"Pursuit of Happyness, The",2006,Drama,pursuit drama,3.7934782608695654,46.0
47122,John Tucker Must Die,2006,Comedy Romance,john tucker must die comedy romance,2.7222222222222223,9.0
47200,Crank,2006,Action Thriller,crank action thriller,3.4285714285714284,14.0
47423,Half Nelson,2006,Drama,half nelson drama,4.0,5.0
47518,Accepted,2006,Comedy,accepted comedy,2.9285714285714284,14.0
47610,"Illusionist, The",2006,Drama Fantasy Mystery Romance,drama fantasy mystery romance,3.7790697674418605,43.0
47629,The Queen,2006,Drama,queen drama,3.730769230769231,13.0
47640,Beerfest,2006,Comedy,beerfest comedy,3.5,6.0
47644,Invincible,2006,Drama,invincible drama,3.0,7.0
47950,Hollywoodland,2006,Crime Drama Mystery Thriller,hollywoodland crime drama mystery thriller,3.2,5.0
47997,Idiocracy,2006,Adventure Comedy Sci-Fi Thriller,idiocracy adventure comedy thriller,3.7222222222222223,18.0
47999,Jesus Camp,2006,Documentary Drama,jesus camp documentary drama,4.071428571428571,7.0
48043,"Fountain, The",2006,Drama Fantasy Romance,drama fantasy romance,3.5,14.0
48082,"Science of Sleep, The (La science des rêves)",2006,Comedy Drama Fantasy Romance,science science des comedy drama fantasy romance,3.8636363636363638,11.0
48142,"Black Dahlia, The",2006,Crime Drama Mystery Thriller,black crime drama mystery thriller,3.25,6.0
48304,Apocalypto,2006,Adventure Drama Thriller,apocalypto adventure drama thriller,3.6052631578947367,19.0
48322,Jackass Number Two,2006,Comedy Documentary,jackass number two comedy documentary,3.5714285714285716,7.0
48385,Borat: Cultural Learnings of America for Make Benefit Glorious Nation of Kazakhstan,2006,Comedy,cultural learnings america make benefit glorious nation kazakhstan comedy,3.3461538461538463,65.0
48394,"Pan's Labyrinth (Laberinto del fauno, El)",2006,Drama Fantasy Thriller,labyrinth del drama fantasy thriller,3.814814814814815,81.0
48516,"Departed, The",2006,Crime Drama Thriller,crime drama thriller,4.252336448598131,107.0
48520,Employee of the Month,2006,Comedy,employee month comedy,2.8333333333333335,6.0
48738,"Last King of Scotland, The",2006,Drama Thriller,last king drama thriller,3.975,20.0
48774,Children of Men,2006,Action Adventure Drama Sci-Fi Thriller,children men action adventure drama thriller,3.9453125,64.0
48780,"Prestige, The",2006,Drama Mystery Sci-Fi Thriller,drama mystery thriller,4.0055555555555555,90.0
48783,Flags of Our Fathers,2006,Drama War,flags fathers drama war,3.4545454545454546,11.0
48877,Saw III,2006,Crime Horror Thriller,saw iii crime horror thriller,3.0454545454545454,11.0
48982,Flushed Away,2006,Animation Comedy,flushed away animation comedy,3.5,7.0
48997,Perfume: The Story of a Murderer,2006,Crime Drama Thriller,story murderer crime drama thriller,3.25,8.0
49272,Casino Royale,2006,Action Adventure Thriller,casino royale action adventure thriller,3.9444444444444446,81.0
49274,Happy Feet,2006,Adventure Animation Children Comedy IMAX,happy feet adventure animation children comedy imax,2.6818181818181817,11.0
49278,Déjà Vu (Deja Vu),2006,Action Sci-Fi Thriller,déjà vu action thriller,3.3,20.0
49286,"Holiday, The",2006,Comedy Romance,comedy romance,3.2083333333333335,24.0
49396,Tenacious D in The Pick of Destiny,2006,Adventure Comedy Musical,tenacious pick destiny adventure comedy musical,3.4444444444444446,9.0
49530,Blood Diamond,2006,Action Adventure Crime Drama Thriller War,blood diamond action adventure crime drama thriller war,3.7641509433962264,53.0
49649,Eragon,2006,Action Adventure Fantasy,eragon action adventure fantasy,2.3333333333333335,12.0
49651,Rocky Balboa,2006,Action Drama,rocky balboa action drama,3.3214285714285716,14.0
49822,"Good Shepherd, The",2006,Drama Thriller,good drama thriller,3.142857142857143,7.0
49824,Dreamgirls,2006,Drama Musical,dreamgirls drama musical,3.1,5.0
49932,Inland Empire,2006,Drama Mystery Thriller,inland empire drama mystery thriller,3.6666666666666665,6.0
50068,Letters from Iwo Jima,2006,Drama War,letters iwo jima drama war,3.7058823529411766,17.0
50442,Alpha Dog,2007,Crime Drama,alpha dog crime drama,3.125,8.0
50601,Bridge to Terabithia,2007,Adventure Children Fantasy,bridge terabithia adventure children fantasy,2.7777777777777777,9.0
50685,Waitress,2007,Comedy Drama Romance,waitress comedy drama romance,3.8333333333333335,6.0
50794,Smokin' Aces,2006,Action Crime Drama Thriller,aces action crime drama thriller,3.1,10.0
50872,Ratatouille,2007,Animation Children Drama,ratatouille animation children drama,3.8680555555555554,72.0
50912,"Paris, I Love You (Paris, je t'aime)",2006,Romance,love je romance,2.9375,8.0
51077,Ghost Rider,2007,Action Fantasy Thriller,ghost rider action fantasy thriller,2.25,12.0
51080,Breach,2007,Drama Thriller,breach drama thriller,3.5625,8.0
51084,Music and Lyrics,2007,Comedy Romance,music lyrics comedy romance,3.1,10.0
51086,"Number 23, The",2007,Drama Mystery Thriller,number drama mystery thriller,2.9285714285714284,14.0
51255,Hot Fuzz,2007,Action Comedy Crime Mystery,hot fuzz action comedy crime mystery,4.0,61.0
51412,Next,2007,Action Sci-Fi Thriller,next action thriller,2.8214285714285716,14.0
51540,Zodiac,2007,Crime Drama Thriller,zodiac crime drama thriller,3.710526315789474,38.0
51575,Wild Hogs,2007,Adventure Comedy,wild hogs adventure comedy,2.3,5.0
51662,300,2007,Action Fantasy War IMAX,action fantasy war imax,3.68125,80.0
51709,"Host, The (Gwoemul)",2006,Comedy Drama Horror Sci-Fi Thriller,comedy drama horror thriller,4.0,7.0
51834,Becoming Jane,2007,Drama Romance,becoming jane drama romance,2.9166666666666665,6.0
51931,Reign Over Me,2007,Drama,reign drama,4.1,5.0
51935,Shooter,2007,Action Drama Thriller,shooter action drama thriller,3.86,25.0
51939,TMNT (Teenage Mutant Ninja Turtles),2007,Action Adventure Animation Children Comedy Fantasy,tmnt mutant ninja action adventure animation children comedy fantasy,3.0833333333333335,6.0
52241,"Lookout, The",2007,Crime Drama Thriller,crime drama thriller,3.25,6.0
52245,Blades of Glory,2007,Comedy Romance,blades glory comedy romance,3.088235294117647,17.0
52281,Grindhouse,2007,Action Crime Horror Sci-Fi Thriller,grindhouse action crime horror thriller,3.425925925925926,27.0
52287,Meet the Robinsons,2007,Action Adventure Animation Children Comedy Sci-Fi,meet robinsons action adventure animation children comedy,3.5454545454545454,11.0
52319,Inglorious Bastards (Quel maledetto treno blindato),1978,Action Adventure Drama War,inglorious bastards maledetto treno action adventure drama war,3.5714285714285716,7.0
52328,Sunshine,2007,Adventure Drama Sci-Fi Thriller,sunshine adventure drama thriller,3.642857142857143,14.0
52435,How the Grinch Stole Christmas!,1966,Animation Comedy Fantasy Musical,grinch stole animation comedy fantasy musical,3.590909090909091,11.0
52458,Disturbia,2007,Drama Thriller,disturbia drama thriller,3.15,10.0
52604,Fracture,2007,Crime Drama Mystery Thriller,fracture crime drama mystery thriller,3.6666666666666665,12.0
52722,Spider-Man 3,2007,Action Adventure Sci-Fi Thriller IMAX,action adventure thriller imax,3.0,44.0
52885,Paprika (Papurika),2006,Animation Mystery Sci-Fi,paprika animation mystery,3.7777777777777777,9.0
52952,This Is England,2006,Drama,england drama,4.0,8.0
52973,Knocked Up,2007,Comedy Drama Romance,knocked comedy drama romance,3.6538461538461537,52.0
52975,Hairspray,2007,Comedy Drama Musical,hairspray comedy drama musical,3.5,15.0
53000,28 Weeks Later,2007,Horror Sci-Fi Thriller,weeks later horror thriller,3.5952380952380953,21.0
53121,Shrek the Third,2007,Adventure Animation Children Comedy Fantasy,shrek third adventure animation children comedy fantasy,3.0238095238095237,21.0
53123,Once,2006,Drama Musical Romance,drama musical romance,3.9444444444444446,9.0
53125,Pirates of the Caribbean: At World's End,2007,Action Adventure Comedy Fantasy,pirates end action adventure comedy fantasy,3.4375,56.0
53129,Mr. Brooks,2007,Crime Drama Thriller,brooks crime drama thriller,4.0,7.0
53322,Ocean's Thirteen,2007,Crime Thriller,thirteen crime thriller,3.484848484848485,33.0
53460,Surf's Up,2007,Animation Children Comedy,animation children comedy,3.5,7.0
53464,Fantastic Four: Rise of the Silver Surfer,2007,Action Adventure Sci-Fi,fantastic rise silver surfer action adventure,2.575,20.0
53468,Fido,2006,Comedy Horror Thriller,fido comedy horror thriller,3.2857142857142856,7.0
53519,Death Proof,2007,Action Adventure Crime Horror Thriller,death proof action adventure crime horror thriller,3.1346153846153846,26.0
53894,Sicko,2007,Documentary Drama,sicko documentary drama,3.7142857142857144,14.0
53953,1408,2007,Drama Horror Thriller,drama horror thriller,3.16,25.0
53972,Live Free or Die Hard,2007,Action Adventure Crime Thriller,live free die hard action adventure crime thriller,3.40625,32.0
53993,Evan Almighty,2007,Comedy Fantasy,evan almighty comedy fantasy,2.5384615384615383,13.0
53996,Transformers,2007,Action Sci-Fi Thriller IMAX,transformers action thriller imax,3.3461538461538463,39.0
54001,Harry Potter and the Order of the Phoenix,2007,Adventure Drama Fantasy IMAX,harry potter order phoenix adventure drama fantasy imax,3.8620689655172415,58.0
54004,I Now Pronounce You Chuck and Larry,2007,Comedy Romance,pronounce chuck larry comedy romance,3.4545454545454546,11.0
54190,Across the Universe,2007,Drama Fantasy Musical Romance,across universe drama fantasy musical romance,4.045454545454546,11.0
54256,Hot Rod,2007,Comedy,hot rod comedy,3.142857142857143,7.0
54259,Stardust,2007,Adventure Comedy Fantasy Romance,stardust adventure comedy fantasy romance,3.6029411764705883,34.0
54272,"Simpsons Movie, The",2007,Animation Comedy,simpsons animation comedy,3.619565217391304,46.0
54281,Charlie Bartlett,2007,Comedy Drama,charlie bartlett comedy drama,3.5,5.0
54286,"Bourne Ultimatum, The",2007,Action Crime Thriller,bourne action crime thriller,3.697530864197531,81.0
54503,Superbad,2007,Comedy,superbad comedy,3.8636363636363638,55.0
54648,Rush Hour 3,2007,Action Comedy Crime Thriller,rush hour action comedy crime thriller,2.7,5.0
54736,"Kingdom, The",2007,Action Drama Thriller,action drama thriller,3.8125,8.0
54881,"King of Kong, The",2007,Documentary,king documentary,3.9166666666666665,12.0
54995,Planet Terror,2007,Action Horror Sci-Fi,planet terror action horror,3.7954545454545454,22.0
54997,3:10 to Yuma,2007,Action Crime Drama Western,yuma action crime drama western,4.06,25.0
54999,Shoot 'Em Up,2007,Action Comedy Crime,shoot action comedy crime,3.4583333333333335,12.0
55052,Atonement,2007,Drama Romance War,atonement drama romance war,3.5384615384615383,13.0
55118,Eastern Promises,2007,Crime Drama Thriller,eastern promises crime drama thriller,4.026315789473684,19.0
55232,Resident Evil: Extinction,2007,Action Horror Sci-Fi Thriller,resident extinction action horror thriller,2.95,10.0
55247,Into the Wild,2007,Action Adventure Drama,wild action adventure drama,3.902439024390244,41.0
55261,"Heartbreak Kid, The",2007,Comedy Drama Romance,heartbreak comedy drama romance,2.5,8.0
55267,Dan in Real Life,2007,Comedy Drama Romance,dan real life comedy drama romance,3.388888888888889,9.0
55269,"Darjeeling Limited, The",2007,Adventure Comedy Drama,darjeeling adventure comedy drama,3.4285714285714284,21.0
55276,Michael Clayton,2007,Drama Thriller,michael clayton drama thriller,3.911764705882353,17.0
55280,Lars and the Real Girl,2007,Comedy Drama,lars real girl comedy drama,3.5625,8.0
55282,30 Days of Night,2007,Horror Thriller,days night horror thriller,3.1818181818181817,11.0
55290,Gone Baby Gone,2007,Crime Drama Mystery,gone baby gone crime drama mystery,3.45,20.0
55363,"Assassination of Jesse James by the Coward Robert Ford, The",2007,Crime Drama Western,assassination jesse james coward robert crime drama western,4.1,10.0
55442,Persepolis,2007,Animation Drama,persepolis animation drama,4.181818181818182,11.0
55577,Saw IV,2007,Crime Horror Thriller,saw iv crime horror thriller,3.2,5.0
55721,Elite Squad (Tropa de Elite),2007,Action Crime Drama Thriller,elite squad de action crime drama thriller,4.3,10.0
55765,American Gangster,2007,Crime Drama Thriller,american gangster crime drama thriller,3.9054054054054053,37.0
55768,Bee Movie,2007,Animation Comedy,bee movie animation comedy,3.15,10.0
55814,"Diving Bell and the Butterfly, The (Scaphandre et le papillon, Le)",2007,Drama,diving bell et le drama,4.1,5.0
55820,No Country for Old Men,2007,Crime Drama,country old men crime drama,3.8984375,64.0
55830,Be Kind Rewind,2008,Comedy,kind rewind comedy,3.4,10.0
55872,August Rush,2007,Drama Musical,august rush drama musical,3.5,6.0
55908,"Man from Earth, The",2007,Drama Sci-Fi,man drama,4.1875,8.0
55995,Beowulf,2007,Action Adventure Animation Fantasy IMAX,beowulf action adventure animation fantasy imax,2.5625,8.0
56145,"Mist, The",2007,Horror Sci-Fi,horror,3.4285714285714284,14.0
56152,Enchanted,2007,Adventure Animation Children Comedy Fantasy Musical Romance,enchanted adventure animation children comedy fantasy musical romance,3.676470588235294,17.0
56156,Hitman,2007,Action Crime Thriller,hitman action crime thriller,3.2857142857142856,7.0
56171,"Golden Compass, The",2007,Adventure Children Fantasy,golden adventure children fantasy,3.111111111111111,18.0
56174,I Am Legend,2007,Action Horror Sci-Fi Thriller IMAX,legend action horror thriller imax,3.4838709677419355,62.0
56251,Futurama: Bender's Big Score,2007,Animation Comedy Sci-Fi,big score animation comedy,3.9,10.0
56339,"Orphanage, The (Orfanato, El)",2007,Drama Horror Mystery Thriller,drama horror mystery thriller,3.875,8.0
56367,Juno,2007,Comedy Drama Romance,juno comedy drama romance,3.769230769230769,65.0
56587,"Bucket List, The",2007,Comedy Drama,bucket comedy drama,3.230769230769231,13.0
56715,Wristcutters: A Love Story,2006,Drama Fantasy Romance,love story drama fantasy romance,4.0,6.0
56757,Sweeney Todd: The Demon Barber of Fleet Street,2007,Drama Horror Musical Thriller,sweeney demon barber fleet street drama horror musical thriller,3.716666666666667,30.0
56775,National Treasure: Book of Secrets,2007,Action Adventure,national book secrets action adventure,3.0416666666666665,24.0
56782,There Will Be Blood,2007,Drama Western,blood drama western,4.142857142857143,28.0
56788,Charlie Wilson's War,2007,Comedy Drama War,charlie war comedy drama war,3.375,8.0
56801,AVPR: Aliens vs. Predator - Requiem,2007,Action Horror Sci-Fi,aliens predator requiem action horror,2.5833333333333335,6.0
56805,Walk Hard: The Dewey Cox Story,2007,Comedy Musical,walk dewey cox story comedy musical,3.3,5.0
56921,Battlestar Galactica: Razor,2007,Action Drama Sci-Fi Thriller,battlestar razor action drama thriller,3.8,5.0
56941,P.S. I Love You,2007,Comedy Drama Romance,love comedy drama romance,3.090909090909091,11.0
